Roaster,CoffeeName,Region,Variety,Processing,TastingNotes,Country
Monogram Coffee,"Algeciras, Colombia, Washed"," HUILA, COLOMBIA "," CATURRA, COLOMBIA, CASTILLO ", WASHED ," RED APPLE, CHOCOLATE, HAZELNUT",COLOMBIA
Monogram Coffee,"Cajamarca, Peru, Washed"," CAJAMARCA, PERU "," CATURRA, TYPICA, CATIMOR PACHE ", WASHED ," APPLE, CARAMEL, TOASTED ALMOND",PERU
Monogram Coffee,"Finca Trapiche, Bolivia, Coco Natural Java"," CARANAVI, BOLIVIA ", JAVA , COCO NATURAL ," FLORAL, APPLE, CARAMEL",BOLIVIA
Monogram Coffee,"La Llama Peaberry, Bolivia, Coco Natural"," CARANAVI, BOLIVIA ", PEABERRY CATURRA , COCO NATURAL ," BLACKBERYY, GUAVA, CHOCOLATE",BOLIVIA
Monogram Coffee,"Lille, Brazil, Tree Dried Natural"," CERRADO, BRAZIL "," BOURBON, CATUAI ", TREE DRIED NATURAL ," PEANUT BUTTER, MILK CHOCOLATE, BROWN SUGAR",BRAZIL
Monogram Coffee,"Los Rodriguez Gesha, Bolivia, Natural Lactic"," CARANAVI, BOLIVIA ", GESHA , NATURAL LACTIC ," GRAPE POPSICLE, WATERMELON, ORANGE",BOLIVIA
